{
  "manifest_version": 2,
  "id": "notemd.deepseek-agent",
  "name": "DeepSeek Agent",
  "version": "1.2.0",
  "kind": "native",
  "engines": {
    "notemd": ">=6.905.6"
  },
  "description": "Run DeepSeek Harness against your vault over the Agent Client Protocol: task templates live in .notemd/agent-tasks, stream live in a window, or fire detached from the CLI. Experimental — depends on a developer-preview release of DeepSeek Harness.",
  "binary": {
    "aarch64-apple-darwin": "bin/notemd-deepseek-agent",
    "x86_64-apple-darwin": "bin/notemd-deepseek-agent"
  },
  "ui": "ui/",
  "activation": {
    "events": [
      "onCommand:open",
      "onCommand:run",
      "onCommand:run-note",
      "onCommand:run-task",
      "onCommand:run-status",
      "onCommand:run-cancel",
      "onCommand:harness-status",
      "onCli:dsagent"
    ]
  },
  "contributes": {
    "menus": [
      {
        "location": "plugins",
        "submenu": "advance",
        "label": "DeepSeek Agent…",
        "command": "open"
      }
    ],
    "windows": [
      {
        "id": "main",
        "entry": "index.html",
        "title": "DeepSeek Agent",
        "width": 900,
        "height": 640,
        "min_width": 640,
        "min_height": 420,
        "open_command": "open"
      }
    ],
    "cli": [
      {
        "subcommand": "dsagent",
        "command": "run",
        "summary": "Run a DeepSeek Agent task headlessly",
        "args": [
          {
            "name": "task",
            "type": "string",
            "required": true,
            "help": "Task id — a directory under .notemd/agent-tasks/"
          }
        ],
        "flags": [
          {
            "long": "--prompt",
            "short": "-p",
            "type": "string",
            "help": "Extra prompt appended to the task's own"
          },
          {
            "long": "--wait",
            "type": "boolean",
            "help": "Run inline and wait for the result (max 300s) instead of detaching"
          }
        ]
      }
    ]
  },
  "i18n": {
    "zh": {
      "name": "DeepSeek 智能体",
      "description": "通过 Agent Client Protocol 在知识库中运行 DeepSeek Harness：支持任务模板、窗口实时输出和 CLI 后台执行。此功能为实验性功能，依赖开发者预览版 DeepSeek Harness。",
      "menus": {
        "open": "DeepSeek 智能体…"
      }
    },
    "ja": {
      "name": "DeepSeek エージェント",
      "description": "Agent Client Protocol 経由で DeepSeek Harness を Vault 内に実行します。タスクテンプレート、ウィンドウへのリアルタイム出力、CLI からのバックグラウンド実行に対応しています。開発者プレビュー版に依存する実験的機能です。",
      "menus": {
        "open": "DeepSeek エージェント…"
      }
    },
    "de": {
      "name": "DeepSeek Agent",
      "description": "DeepSeek Harness über das Agent Client Protocol im Vault ausführen – mit Aufgabenvorlagen, Live-Ausgabe im Fenster und Hintergrundstart per CLI. Experimentell; erfordert eine Entwickler-Vorschau von DeepSeek Harness.",
      "menus": {
        "open": "DeepSeek Agent…"
      }
    }
  },
  "capabilities": [
    "ui",
    "toast",
    "vault.read",
    "editor.open",
    "notify",
    "settings"
  ],
  "request_timeout_seconds": 300
}
