{
  "manifest_version": 2,
  "id": "notemd.ebook-import",
  "name": "Ebook Import",
  "version": "1.5.3",
  "kind": "native",
  "engines": {
    "notemd": ">=6.910.1"
  },
  "description": "Import ebooks as Markdown, enrich book metadata and covers from Open Library and Apple Books, and maintain readable cover-gallery indexes that refresh when book categories change. Includes Calibre conversion, scanned-PDF OCR, and AI-assisted reading and classification.",
  "binary": {
    "aarch64-apple-darwin": "bin/notemd-ebook-import",
    "x86_64-apple-darwin": "bin/notemd-ebook-import"
  },
  "ui": "ui/",
  "activation": {
    "events": [
      "onCommand:open",
      "onCli:ebook"
    ]
  },
  "contributes": {
    "menus": [
      {
        "location": "plugins",
        "submenu": "reading",
        "label": "Import Ebooks (epub/pdf/docx)…",
        "command": "open"
      }
    ],
    "windows": [
      {
        "id": "main",
        "entry": "index.html",
        "title": "Ebook Import",
        "width": 900,
        "height": 640,
        "min_width": 640,
        "min_height": 480,
        "open_command": "open"
      }
    ],
    "cli": [
      {
        "subcommand": "ebook",
        "command": "import",
        "summary": "Import an ebook into the vault as markdown",
        "args": [
          {
            "name": "file",
            "type": "string",
            "required": true,
            "help": "Path to .epub/.pdf/.docx"
          }
        ],
        "flags": [
          {
            "long": "--ocr",
            "type": "boolean",
            "help": "OCR mode for scanned PDFs"
          },
          {
            "long": "--ocr-provider",
            "type": "string",
            "help": "wechat | baidu (default: settings)"
          },
          {
            "long": "--root",
            "type": "string",
            "help": "Vault-relative ebooks root (default: settings)"
          },
          {
            "long": "--topic",
            "type": "string",
            "help": "Required topic id from <ebooks-root>/topics.yml"
          }
        ]
      }
    ]
  },
  "capabilities": [
    "ui",
    "toast",
    "dialog",
    "vault.read",
    "vault.write",
    "editor.open",
    "agent"
  ],
  "request_timeout_seconds": 300,
  "i18n": {
    "zh": {
      "name": "导入电子书",
      "description": "将电子书导入为 Markdown，从 Open Library 与 Apple Books 补全书目和封面，自动生成便于阅读的封面画廊索引，并在书籍分类变更后即时更新。支持 Calibre 转换、扫描 PDF OCR、AI 阅读与分类。",
      "menus": {
        "open": "导入电子书(epub、pdf、docx)…"
      }
    },
    "ja": {
      "name": "電子書籍を取り込む",
      "description": "EPUB・PDF・DOCX を Markdown に変換して Vault へ取り込みます。新しい本を最大8つの管理可能なテーマに分類し、テーマ索引を自動更新します。AIによるテーマ設計にも対応します。",
      "menus": {
        "open": "電子書籍を取り込む(epub・pdf・docx)…"
      }
    },
    "de": {
      "name": "E-Books importieren",
      "description": "EPUB-, PDF- und DOCX-E-Books als Markdown importieren. Jedes neue Buch wird einem von bis zu acht verwalteten Themen zugeordnet; Themenindizes werden automatisch gepflegt und können per KI entworfen werden.",
      "menus": {
        "open": "E-Books importieren (epub/pdf/docx)…"
      }
    }
  }
}
