{
  "manifest_version": 2,
  "id": "notemd.pos-log",
  "name": "Position Log",
  "version": "1.0.3",
  "kind": "native",
  "engines": { "notemd": ">=6.716.7" },
  "description": "Log your location (by IP geolocation) to the vault: appends country-province-city to pos/YYYY-MM-DD-pos.md whenever it changes (every 30 min or on demand)",
  "binary": {
    "aarch64-apple-darwin": "bin/notemd-pos-log",
    "x86_64-apple-darwin": "bin/notemd-pos-log"
  },
  "activation": { "events": ["onStartupFinished", "onCommand:save-now"] },
  "contributes": {
    "menus": [
      { "location": "plugins", "label": "Save Location Now", "command": "save-now" }
    ]
  },
  "capabilities": ["vault.read", "vault.write", "toast"],
  "request_timeout_seconds": 30
}
