{
  "manifest_version": 2,
  "id": "notemd.exlibris",
  "name": "ExLibris",
  "version": "1.0.0",
  "kind": "native",
  "engines": { "notemd": ">=6.716.7" },
  "description": "Import ebooks into your library: extract metadata via calibre, apply routing rules, and file each book into the sotvault. The whole import pipeline runs in this plugin's own process; the shared config (sotvault/rawvault/calibre) lives at the same path the standalone app used.",
  "binary": {
    "aarch64-apple-darwin": "bin/notemd-exlibris",
    "x86_64-apple-darwin": "bin/notemd-exlibris"
  },
  "ui": "ui/",
  "activation": { "events": ["onCommand:open"] },
  "contributes": {
    "menus": [
      { "location": "window", "label": "ExLibris (v2)", "command": "open" }
    ],
    "windows": [
      {
        "id": "main",
        "entry": "index.html",
        "title": "ExLibris",
        "width": 1100.0,
        "height": 720.0,
        "min_width": 720.0,
        "min_height": 500.0,
        "open_command": "open"
      }
    ]
  },
  "capabilities": ["dialog", "toast"]
}
