{
  "manifest_version": 2,
  "id": "notemd.weekly-review",
  "name": "Weekly Review",
  "version": "1.0.6",
  "kind": "native",
  "engines": {
    "notemd": ">=6.828.3"
  },
  "description": "A year-at-a-glance calendar of your weekly reviews.",
  "ui": "ui/",
  "activation": {
    "events": [
      "onCommand:open"
    ]
  },
  "contributes": {
    "menus": [
      {
        "location": "window",
        "submenu": "reflect",
        "label": "Weekly Review",
        "command": "open"
      }
    ],
    "windows": [
      {
        "id": "main",
        "entry": "index.html",
        "title": "Weekly Review",
        "width": 1000,
        "height": 720,
        "min_width": 820,
        "min_height": 560,
        "open_command": "open"
      }
    ],
    "tray": [
      {
        "window": "main"
      }
    ]
  },
  "capabilities": [
    "vault.read",
    "editor.open",
    "toast"
  ],
  "i18n": {
    "zh": {
      "name": "周检视",
      "description": "用全年日历总览每周复盘记录。",
      "menus": {
        "open": "周检视"
      }
    },
    "ja": {
      "name": "ウィークリーレビュー",
      "description": "毎週の振り返りを年間カレンダーで一覧できます。",
      "menus": {
        "open": "ウィークリーレビュー"
      }
    },
    "de": {
      "name": "Wochenrückblick",
      "description": "Die wöchentlichen Rückblicke in einem Jahreskalender auf einen Blick erfassen.",
      "menus": {
        "open": "Wochenrückblick"
      }
    }
  }
}
