{
  "manifest_version": 2,
  "id": "notemd.strata",
  "name": "STRATA",
  "version": "0.1.2",
  "kind": "native",
  "engines": {
    "notemd": ">=6.930.2"
  },
  "description": "Explore Vault index and extracted meeting knowledge as contour maps and 3D terrain, with separate date filters, layouts and source details. Requires note.md 6.930.2 or later.",
  "binary": {
    "aarch64-apple-darwin": "bin/notemd-strata",
    "x86_64-apple-darwin": "bin/notemd-strata"
  },
  "ui": "ui/",
  "activation": {
    "events": [
      "onCommand:open"
    ]
  },
  "contributes": {
    "menus": [
      {
        "location": "plugins",
        "submenu": "thinking",
        "label": "Open STRATA…",
        "command": "open"
      }
    ],
    "windows": [
      {
        "id": "main",
        "entry": "index.html",
        "title": "STRATA · 层峦",
        "width": 1280,
        "height": 840,
        "min_width": 800,
        "min_height": 560,
        "singleton": true,
        "open_command": "open"
      }
    ]
  },
  "capabilities": [
    "vault.read",
    "index.read",
    "agent",
    "editor.open",
    "settings",
    "ui"
  ],
  "request_timeout_seconds": 300,
  "i18n": {
    "zh": {
      "name": "STRATA · 层峦",
      "description": "切换全 Vault 索引与会议知识，以等高线和三维山体探索知识、关系及来源，分别保存日期与布局。需 note.md 6.930.2 或更新版本。",
      "menus": {
        "open": "打开层峦…"
      }
    }
  }
}
