{
  "manifest_version": 2,
  "id": "notemd.memory",
  "name": "Memory",
  "version": "2.5.3",
  "kind": "native",
  "engines": {
    "notemd": ">=6.906.1"
  },
  "description": "Manage structured Memory claims and preview a local governed document where people edit directly and isolated Agents submit reviewable changes.",
  "ui": "ui/",
  "activation": {
    "events": [
      "onCommand:open"
    ]
  },
  "contributes": {
    "menus": [
      {
        "location": "plugins",
        "submenu": "reflect",
        "label": "Memory",
        "command": "open"
      }
    ],
    "windows": [
      {
        "id": "main",
        "entry": "index.html",
        "title": "Memory",
        "width": 1080,
        "height": 760,
        "min_width": 760,
        "min_height": 560,
        "open_command": "open"
      }
    ],
    "tray": [
      {
        "window": "main"
      }
    ]
  },
  "capabilities": [
    "memory.control",
    "clipboard.write",
    "vault.read",
    "vault.write",
    "editor.kit",
    "cdr.repository",
    "agent",
    "toast"
  ],
  "i18n": {
    "zh": {
      "name": "记忆",
      "description": "管理结构化记忆主张，并预览人可直接编辑、隔离 Agent 只提交待审阅修改的本机受控文档。",
      "menus": {
        "open": "记忆"
      }
    },
    "ja": {
      "name": "メモリ",
      "description": "構造化メモリを管理し、人が直接編集して分離された Agent がレビュー可能な変更だけを提案するローカル文書をプレビューします。",
      "menus": {
        "open": "メモリ"
      }
    },
    "de": {
      "name": "Gedächtnis",
      "description": "Strukturierte Memory-Claims verwalten und ein lokal kontrolliertes Dokument testen, das Menschen direkt bearbeiten und isolierte Agents nur über prüfbare Vorschläge ändern.",
      "menus": {
        "open": "Gedächtnis"
      }
    }
  }
}
